{
  "legislative_session": "2025-2026",
  "identifier": "H 136",
  "title": "An act relating to health insurance coverage for biomarker testing",
  "from_organization": "~{\"classification\": \"lower\"}",
  "classification": [
    "bill"
  ],
  "subject": [],
  "abstracts": [],
  "other_titles": [],
  "other_identifiers": [],
  "actions": [
    {
      "description": "Read first time and referred to the Committee on Health Care",
      "date": "2025-02-04",
      "organization_id": "~{\"classification\": \"lower\"}",
      "classification": [
        "introduction"
      ],
      "related_entities": [],
      "_processing": {
        "log_file_created": "2025-11-26T05:54:35Z"
      }
    }
  ],
  "sponsorships": [
    {
      "name": "Kate McCann",
      "classification": "primary",
      "entity_type": "person",
      "primary": true,
      "person_id": "~{\"chamber\": \"lower\", \"name\": \"Kate McCann\"}",
      "organization_id": null
    },
    {
      "name": "Brian Cina",
      "classification": "primary",
      "entity_type": "person",
      "primary": true,
      "person_id": "~{\"chamber\": \"lower\", \"name\": \"Brian Cina\"}",
      "organization_id": null
    },
    {
      "name": "Lisa Hango",
      "classification": "primary",
      "entity_type": "person",
      "primary": true,
      "person_id": "~{\"chamber\": \"lower\", \"name\": \"Lisa Hango\"}",
      "organization_id": null
    },
    {
      "name": "Elanor Chapin",
      "classification": "cosponsor",
      "entity_type": "person",
      "primary": false,
      "person_id": "~{\"chamber\": \"lower\", \"name\": \"Elanor Chapin\"}",
      "organization_id": null
    },
    {
      "name": "Esme Cole",
      "classification": "cosponsor",
      "entity_type": "person",
      "primary": false,
      "person_id": "~{\"chamber\": \"lower\", \"name\": \"Esme Cole\"}",
      "organization_id": null
    },
    {
      "name": "Leonora Dodge",
      "classification": "cosponsor",
      "entity_type": "person",
      "primary": false,
      "person_id": "~{\"chamber\": \"lower\", \"name\": \"Leonora Dodge\"}",
      "organization_id": null
    },
    {
      "name": "Troy Headrick",
      "classification": "cosponsor",
      "entity_type": "person",
      "primary": false,
      "person_id": "~{\"chamber\": \"lower\", \"name\": \"Troy Headrick\"}",
      "organization_id": null
    },
    {
      "name": "Mary Howard",
      "classification": "cosponsor",
      "entity_type": "person",
      "primary": false,
      "person_id": "~{\"chamber\": \"lower\", \"name\": \"Mary Howard\"}",
      "organization_id": null
    },
    {
      "name": "Emilie Krasnow",
      "classification": "cosponsor",
      "entity_type": "person",
      "primary": false,
      "person_id": "~{\"chamber\": \"lower\", \"name\": \"Emilie Krasnow\"}",
      "organization_id": null
    },
    {
      "name": "Larry Labor",
      "classification": "cosponsor",
      "entity_type": "person",
      "primary": false,
      "person_id": "~{\"chamber\": \"lower\", \"name\": \"Larry Labor\"}",
      "organization_id": null
    },
    {
      "name": "Kate Logan",
      "classification": "cosponsor",
      "entity_type": "person",
      "primary": false,
      "person_id": "~{\"chamber\": \"lower\", \"name\": \"Kate Logan\"}",
      "organization_id": null
    },
    {
      "name": "Jubilee McGill",
      "classification": "cosponsor",
      "entity_type": "person",
      "primary": false,
      "person_id": "~{\"chamber\": \"lower\", \"name\": \"Jubilee McGill\"}",
      "organization_id": null
    },
    {
      "name": "Brian Minier",
      "classification": "cosponsor",
      "entity_type": "person",
      "primary": false,
      "person_id": "~{\"chamber\": \"lower\", \"name\": \"Brian Minier\"}",
      "organization_id": null
    },
    {
      "name": "Leland Morgan",
      "classification": "cosponsor",
      "entity_type": "person",
      "primary": false,
      "person_id": "~{\"chamber\": \"lower\", \"name\": \"Leland Morgan\"}",
      "organization_id": null
    },
    {
      "name": "Michael Mrowicki",
      "classification": "cosponsor",
      "entity_type": "person",
      "primary": false,
      "person_id": "~{\"chamber\": \"lower\", \"name\": \"Michael Mrowicki\"}",
      "organization_id": null
    },
    {
      "name": "Richard Nelson",
      "classification": "cosponsor",
      "entity_type": "person",
      "primary": false,
      "person_id": "~{\"chamber\": \"lower\", \"name\": \"Richard Nelson\"}",
      "organization_id": null
    },
    {
      "name": "Phil Pouech",
      "classification": "cosponsor",
      "entity_type": "person",
      "primary": false,
      "person_id": "~{\"chamber\": \"lower\", \"name\": \"Phil Pouech\"}",
      "organization_id": null
    },
    {
      "name": "Monique Priestley",
      "classification": "cosponsor",
      "entity_type": "person",
      "primary": false,
      "person_id": "~{\"chamber\": \"lower\", \"name\": \"Monique Priestley\"}",
      "organization_id": null
    },
    {
      "name": "Barbara Rachelson",
      "classification": "cosponsor",
      "entity_type": "person",
      "primary": false,
      "person_id": "~{\"chamber\": \"lower\", \"name\": \"Barbara Rachelson\"}",
      "organization_id": null
    },
    {
      "name": "Thomas Stevens",
      "classification": "cosponsor",
      "entity_type": "person",
      "primary": false,
      "person_id": "~{\"chamber\": \"lower\", \"name\": \"Thomas Stevens\"}",
      "organization_id": null
    },
    {
      "name": "Mary-Katherine Stone",
      "classification": "cosponsor",
      "entity_type": "person",
      "primary": false,
      "person_id": "~{\"chamber\": \"lower\", \"name\": \"Mary-Katherine Stone\"}",
      "organization_id": null
    },
    {
      "name": "Christopher Taylor",
      "classification": "cosponsor",
      "entity_type": "person",
      "primary": false,
      "person_id": "~{\"chamber\": \"lower\", \"name\": \"Christopher Taylor\"}",
      "organization_id": null
    }
  ],
  "related_bills": [],
  "versions": [
    {
      "note": "As Introduced",
      "links": [
        {
          "url": "https://legislature.vermont.gov/Documents/2026/Docs/BILLS/H-0136/H-0136%20As%20Introduced.pdf",
          "media_type": "application/pdf"
        }
      ],
      "date": "",
      "classification": ""
    }
  ],
  "documents": [
    {
      "note": "Witness List",
      "links": [
        {
          "url": "https://legislature.vermont.gov/bill/print/2026/H136/witnesses",
          "media_type": "text/html"
        }
      ],
      "date": "",
      "classification": ""
    },
    {
      "note": "Committee Meetings",
      "links": [
        {
          "url": "https://legislature.vermont.gov/bill/print/2026/H136/meetings",
          "media_type": "text/html"
        }
      ],
      "date": "",
      "classification": ""
    }
  ],
  "citations": [],
  "sources": [
    {
      "url": "http://legislature.vermont.gov/bill/loadBillsIntroduced/2026/",
      "note": ""
    },
    {
      "url": "http://legislature.vermont.gov/bill/status/2026/H.136",
      "note": ""
    },
    {
      "url": "http://legislature.vermont.gov/bill/loadBillDetailedStatus/2026/533",
      "note": ""
    },
    {
      "url": "http://legislature.vermont.gov/bill/loadBillRollCalls/2026/533",
      "note": ""
    }
  ],
  "extras": {},
  "jurisdiction": {
    "id": "ocd-jurisdiction/country:us/state:vt/government",
    "name": "Vermont",
    "classification": "state",
    "division_id": "ocd-division/country:us/state:vt"
  },
  "_processing": {
    "logs_latest_update": "2025-11-26T05:54:35Z"
  }
}