{
  "legislative_session": "2025",
  "identifier": "HB5674",
  "title": "AN ACT RELATING TO PROPERTY -- RESIDENTIAL LANDLORD AND TENANT ACT",
  "from_organization": "~{\"classification\": \"lower\"}",
  "classification": [
    "bill"
  ],
  "subject": [],
  "abstracts": [
    {
      "note": "summary",
      "abstract": "Prohibits a landlord from inquiring about the immigration status of a tenant subject to any federal laws or regulations, but may request financial information or proof of identity."
    }
  ],
  "other_titles": [],
  "other_identifiers": [],
  "actions": [
    {
      "description": "02/26/2025 Introduced, referred to House Judiciary",
      "date": "2025-02-26",
      "organization_id": "~{\"classification\": \"lower\"}",
      "classification": [
        "introduction",
        "referral-committee"
      ],
      "related_entities": [],
      "_processing": {
        "log_file_created": "2025-11-26T03:05:00Z"
      }
    },
    {
      "description": "03/14/2025 Scheduled for hearing and/or consideration  (03/18/2025)",
      "date": "2025-03-14",
      "organization_id": "~{\"classification\": \"legislature\"}",
      "classification": [],
      "related_entities": [],
      "_processing": {
        "log_file_created": "2025-11-26T03:05:00Z"
      }
    },
    {
      "description": "03/18/2025 Committee recommended measure be held for further study",
      "date": "2025-03-18",
      "organization_id": "~{\"classification\": \"legislature\"}",
      "classification": [
        "committee-failure"
      ],
      "related_entities": [],
      "_processing": {
        "log_file_created": "2025-11-26T03:05:00Z"
      }
    },
    {
      "description": "05/30/2025 Scheduled for consideration  (06/05/2025)",
      "date": "2025-05-30",
      "organization_id": "~{\"classification\": \"legislature\"}",
      "classification": [],
      "related_entities": [],
      "_processing": {
        "log_file_created": "2025-11-26T03:05:00Z"
      }
    },
    {
      "description": "06/05/2025 Committee recommends passage",
      "date": "2025-06-05",
      "organization_id": "~{\"classification\": \"legislature\"}",
      "classification": [
        "committee-passage-favorable"
      ],
      "related_entities": [],
      "_processing": {
        "log_file_created": "2025-11-26T03:05:00Z"
      }
    },
    {
      "description": "06/13/2025 Placed on House Calendar  (06/16/2025)",
      "date": "2025-06-13",
      "organization_id": "~{\"classification\": \"lower\"}",
      "classification": [
        "reading-3"
      ],
      "related_entities": [],
      "_processing": {
        "log_file_created": "2025-11-26T03:05:00Z"
      }
    },
    {
      "description": "06/16/2025 House read and passed",
      "date": "2025-06-16",
      "organization_id": "~{\"classification\": \"lower\"}",
      "classification": [
        "passage"
      ],
      "related_entities": [],
      "_processing": {
        "log_file_created": "2025-11-26T03:05:00Z"
      }
    },
    {
      "description": "06/18/2025 Placed on Senate Calendar  (06/20/2025)",
      "date": "2025-06-18",
      "organization_id": "~{\"classification\": \"upper\"}",
      "classification": [
        "reading-3"
      ],
      "related_entities": [],
      "_processing": {
        "log_file_created": "2025-11-26T03:05:00Z"
      }
    },
    {
      "description": "06/21/2025 Senate passed in concurrence",
      "date": "2025-06-21",
      "organization_id": "~{\"classification\": \"upper\"}",
      "classification": [
        "passage"
      ],
      "related_entities": [],
      "_processing": {
        "log_file_created": "2025-11-26T03:05:00Z"
      }
    },
    {
      "description": "06/27/2025 Transmitted to Governor",
      "date": "2025-06-27",
      "organization_id": "~{\"classification\": \"executive\"}",
      "classification": [
        "executive-receipt"
      ],
      "related_entities": [],
      "_processing": {
        "log_file_created": "2025-11-26T03:05:00Z"
      }
    },
    {
      "description": "07/02/2025 Signed by Governor",
      "date": "2025-07-02",
      "organization_id": "~{\"classification\": \"executive\"}",
      "classification": [
        "executive-signature"
      ],
      "related_entities": [],
      "_processing": {
        "log_file_created": "2025-11-26T03:05:00Z"
      }
    }
  ],
  "sponsorships": [
    {
      "name": "Giraldo",
      "classification": "primary",
      "entity_type": "person",
      "primary": true,
      "person_id": "~{\"name\": \"Giraldo\"}",
      "organization_id": null
    },
    {
      "name": "Potter",
      "classification": "primary",
      "entity_type": "person",
      "primary": true,
      "person_id": "~{\"name\": \"Potter\"}",
      "organization_id": null
    },
    {
      "name": "Morales",
      "classification": "primary",
      "entity_type": "person",
      "primary": true,
      "person_id": "~{\"name\": \"Morales\"}",
      "organization_id": null
    },
    {
      "name": "Stewart",
      "classification": "primary",
      "entity_type": "person",
      "primary": true,
      "person_id": "~{\"name\": \"Stewart\"}",
      "organization_id": null
    },
    {
      "name": "Biah",
      "classification": "primary",
      "entity_type": "person",
      "primary": true,
      "person_id": "~{\"name\": \"Biah\"}",
      "organization_id": null
    },
    {
      "name": "Tanzi",
      "classification": "primary",
      "entity_type": "person",
      "primary": true,
      "person_id": "~{\"name\": \"Tanzi\"}",
      "organization_id": null
    },
    {
      "name": "Felix",
      "classification": "primary",
      "entity_type": "person",
      "primary": true,
      "person_id": "~{\"name\": \"Felix\"}",
      "organization_id": null
    }
  ],
  "related_bills": [],
  "versions": [
    {
      "note": "5674",
      "links": [
        {
          "url": "http://webserver.rilegislature.gov/BillText/BillText25/HouseText25/H5674.pdf",
          "media_type": "application/pdf"
        }
      ],
      "date": "",
      "classification": ""
    }
  ],
  "documents": [],
  "citations": [],
  "sources": [
    {
      "url": "https://status.rilegislature.gov/",
      "note": ""
    }
  ],
  "extras": {},
  "jurisdiction": {
    "id": "ocd-jurisdiction/country:us/state:ri/government",
    "name": "Rhode Island",
    "classification": "state",
    "division_id": "ocd-division/country:us/state:ri"
  },
  "_processing": {
    "logs_latest_update": "2025-11-26T03:05:00Z"
  }
}