{
  "legislative_session": "2025",
  "identifier": "HB6178",
  "title": "AN ACT RELATING TO TOWN AND CITIES -- LOW AND MODERATE INCOME HOUSING--COMPREHENSIVE PERMIT PROJECTS IN TIVERTON",
  "from_organization": "~{\"classification\": \"lower\"}",
  "classification": [
    "bill"
  ],
  "subject": [],
  "abstracts": [
    {
      "note": "summary",
      "abstract": "Prohibits applications filed in the town of Tiverton, for comprehensive permit projects, for low and moderate income housing, to include accessory dwelling units."
    }
  ],
  "other_titles": [],
  "other_identifiers": [],
  "actions": [
    {
      "description": "04/04/2025 Introduced, referred to House Municipal Government & Housing",
      "date": "2025-04-04",
      "organization_id": "~{\"classification\": \"lower\"}",
      "classification": [
        "introduction",
        "referral-committee"
      ],
      "related_entities": [],
      "_processing": {
        "log_file_created": "2025-11-26T03:05:04Z"
      }
    },
    {
      "description": "05/30/2025 Scheduled for hearing and/or consideration  (06/04/2025)",
      "date": "2025-05-30",
      "organization_id": "~{\"classification\": \"legislature\"}",
      "classification": [],
      "related_entities": [],
      "_processing": {
        "log_file_created": "2025-11-26T03:05:04Z"
      }
    },
    {
      "description": "06/04/2025 Committee recommended measure be held for further study",
      "date": "2025-06-04",
      "organization_id": "~{\"classification\": \"legislature\"}",
      "classification": [
        "committee-failure"
      ],
      "related_entities": [],
      "_processing": {
        "log_file_created": "2025-11-26T03:05:04Z"
      }
    }
  ],
  "sponsorships": [
    {
      "name": "Edwards",
      "classification": "primary",
      "entity_type": "person",
      "primary": true,
      "person_id": "~{\"name\": \"Edwards\"}",
      "organization_id": null
    },
    {
      "name": "McGaw",
      "classification": "primary",
      "entity_type": "person",
      "primary": true,
      "person_id": "~{\"name\": \"McGaw\"}",
      "organization_id": null
    }
  ],
  "related_bills": [],
  "versions": [
    {
      "note": "6178",
      "links": [
        {
          "url": "http://webserver.rilegislature.gov/BillText/BillText25/HouseText25/H6178.pdf",
          "media_type": "application/pdf"
        }
      ],
      "date": "",
      "classification": ""
    }
  ],
  "documents": [],
  "citations": [],
  "sources": [
    {
      "url": "https://status.rilegislature.gov/",
      "note": ""
    }
  ],
  "extras": {},
  "jurisdiction": {
    "id": "ocd-jurisdiction/country:us/state:ri/government",
    "name": "Rhode Island",
    "classification": "state",
    "division_id": "ocd-division/country:us/state:ri"
  },
  "_processing": {
    "logs_latest_update": "2025-11-26T03:05:04Z"
  }
}