{
  "legislative_session": "2025",
  "identifier": "SB892",
  "title": "AN ACT RELATING TO PUBLIC UTILITIES AND CARRIERS -- 988 SUICIDE AND CRISIS LIFELINE CALL CENTER FUNDING AND OPERATIONAL INDEPENDENCE",
  "from_organization": "~{\"classification\": \"upper\"}",
  "classification": [
    "bill"
  ],
  "subject": [],
  "abstracts": [
    {
      "note": "summary",
      "abstract": "Establishes a restricted receipt account, known as the \u201c988 Call Center Fund,\u201d to be held and administered by the state to support the 988 call center budget."
    }
  ],
  "other_titles": [],
  "other_identifiers": [],
  "actions": [
    {
      "description": "03/27/2025 Introduced, referred to Senate Finance",
      "date": "2025-03-27",
      "organization_id": "~{\"classification\": \"upper\"}",
      "classification": [
        "introduction",
        "referral-committee"
      ],
      "related_entities": [],
      "_processing": {
        "log_file_created": "2025-11-26T03:04:57Z"
      }
    },
    {
      "description": "04/18/2025 Scheduled for hearing and/or consideration  (04/22/2025)",
      "date": "2025-04-18",
      "organization_id": "~{\"classification\": \"legislature\"}",
      "classification": [],
      "related_entities": [],
      "_processing": {
        "log_file_created": "2025-11-26T03:04:57Z"
      }
    },
    {
      "description": "04/21/2025 Meeting postponed  (04/22/2025)",
      "date": "2025-04-21",
      "organization_id": "~{\"classification\": \"legislature\"}",
      "classification": [],
      "related_entities": [],
      "_processing": {
        "log_file_created": "2025-11-26T03:04:57Z"
      }
    },
    {
      "description": "05/03/2025 Scheduled for hearing and/or consideration  (05/06/2025)",
      "date": "2025-05-03",
      "organization_id": "~{\"classification\": \"legislature\"}",
      "classification": [],
      "related_entities": [],
      "_processing": {
        "log_file_created": "2025-11-26T03:04:57Z"
      }
    },
    {
      "description": "05/06/2025 Committee recommended measure be held for further study",
      "date": "2025-05-06",
      "organization_id": "~{\"classification\": \"legislature\"}",
      "classification": [
        "committee-failure"
      ],
      "related_entities": [],
      "_processing": {
        "log_file_created": "2025-11-26T03:04:57Z"
      }
    },
    {
      "description": "06/03/2025 Scheduled for consideration  (06/05/2025)",
      "date": "2025-06-03",
      "organization_id": "~{\"classification\": \"legislature\"}",
      "classification": [],
      "related_entities": [],
      "_processing": {
        "log_file_created": "2025-11-26T03:04:57Z"
      }
    },
    {
      "description": "06/04/2025 Proposed Substitute",
      "date": "2025-06-04",
      "organization_id": "~{\"classification\": \"legislature\"}",
      "classification": [
        "substitution"
      ],
      "related_entities": [],
      "_processing": {
        "log_file_created": "2025-11-26T03:04:57Z"
      }
    },
    {
      "description": "06/05/2025 Committee recommends passage of Sub A",
      "date": "2025-06-05",
      "organization_id": "~{\"classification\": \"legislature\"}",
      "classification": [
        "committee-passage-favorable"
      ],
      "related_entities": [],
      "_processing": {
        "log_file_created": "2025-11-26T03:04:57Z"
      }
    },
    {
      "description": "06/18/2025 Placed on Senate Calendar  (06/20/2025)",
      "date": "2025-06-18",
      "organization_id": "~{\"classification\": \"upper\"}",
      "classification": [
        "reading-3"
      ],
      "related_entities": [],
      "_processing": {
        "log_file_created": "2025-11-26T03:04:57Z"
      }
    },
    {
      "description": "06/20/2025 Senate passed Sub A",
      "date": "2025-06-20",
      "organization_id": "~{\"classification\": \"upper\"}",
      "classification": [
        "passage"
      ],
      "related_entities": [],
      "_processing": {
        "log_file_created": "2025-11-26T03:04:57Z"
      }
    }
  ],
  "sponsorships": [
    {
      "name": "Murray",
      "classification": "primary",
      "entity_type": "person",
      "primary": true,
      "person_id": "~{\"name\": \"Murray\"}",
      "organization_id": null
    },
    {
      "name": "DiPalma",
      "classification": "primary",
      "entity_type": "person",
      "primary": true,
      "person_id": "~{\"name\": \"DiPalma\"}",
      "organization_id": null
    },
    {
      "name": "Lawson",
      "classification": "primary",
      "entity_type": "person",
      "primary": true,
      "person_id": "~{\"name\": \"Lawson\"}",
      "organization_id": null
    },
    {
      "name": "Tikoian",
      "classification": "primary",
      "entity_type": "person",
      "primary": true,
      "person_id": "~{\"name\": \"Tikoian\"}",
      "organization_id": null
    },
    {
      "name": "Felag",
      "classification": "primary",
      "entity_type": "person",
      "primary": true,
      "person_id": "~{\"name\": \"Felag\"}",
      "organization_id": null
    },
    {
      "name": "Gallo",
      "classification": "primary",
      "entity_type": "person",
      "primary": true,
      "person_id": "~{\"name\": \"Gallo\"}",
      "organization_id": null
    },
    {
      "name": "DiMario",
      "classification": "primary",
      "entity_type": "person",
      "primary": true,
      "person_id": "~{\"name\": \"DiMario\"}",
      "organization_id": null
    },
    {
      "name": "Bissaillon",
      "classification": "primary",
      "entity_type": "person",
      "primary": true,
      "person_id": "~{\"name\": \"Bissaillon\"}",
      "organization_id": null
    },
    {
      "name": "Lauria",
      "classification": "primary",
      "entity_type": "person",
      "primary": true,
      "person_id": "~{\"name\": \"Lauria\"}",
      "organization_id": null
    },
    {
      "name": "Valverde",
      "classification": "primary",
      "entity_type": "person",
      "primary": true,
      "person_id": "~{\"name\": \"Valverde\"}",
      "organization_id": null
    }
  ],
  "related_bills": [],
  "versions": [
    {
      "note": "892\u00a0 SUB A",
      "links": [
        {
          "url": "http://webserver.rilegislature.gov/BillText/BillText25/SenateText25/S0892A.pdf",
          "media_type": "application/pdf"
        }
      ],
      "date": "",
      "classification": ""
    }
  ],
  "documents": [],
  "citations": [],
  "sources": [
    {
      "url": "https://status.rilegislature.gov/",
      "note": ""
    }
  ],
  "extras": {},
  "jurisdiction": {
    "id": "ocd-jurisdiction/country:us/state:ri/government",
    "name": "Rhode Island",
    "classification": "state",
    "division_id": "ocd-division/country:us/state:ri"
  },
  "_processing": {
    "logs_latest_update": "2025-11-26T03:04:57Z"
  }
}