{
  "legislative_session": "2025",
  "identifier": "SR880",
  "title": "SENATE RESOLUTION COMMEMORATING MARCH 25, 2025, AS THE 204TH ANNIVERSARY OF GREEK INDEPENDENCE DAY AND CELEBRATING DEMOCRACY IN GREECE AND THE UNITED STATES",
  "from_organization": "~{\"classification\": \"upper\"}",
  "classification": [
    "resolution"
  ],
  "subject": [],
  "abstracts": [],
  "other_titles": [],
  "other_identifiers": [],
  "actions": [
    {
      "description": "03/25/2025 Recommended for Immediate Consideration",
      "date": "2025-03-25",
      "organization_id": "~{\"classification\": \"legislature\"}",
      "classification": [],
      "related_entities": [],
      "_processing": {
        "log_file_created": "2025-11-26T03:04:58Z"
      }
    },
    {
      "description": "03/25/2025 Senate read and passed",
      "date": "2025-03-25",
      "organization_id": "~{\"classification\": \"upper\"}",
      "classification": [
        "passage"
      ],
      "related_entities": [],
      "_processing": {
        "log_file_created": "2025-11-26T03:04:58Z"
      }
    }
  ],
  "sponsorships": [
    {
      "name": "Raptakis",
      "classification": "primary",
      "entity_type": "person",
      "primary": true,
      "person_id": "~{\"name\": \"Raptakis\"}",
      "organization_id": null
    },
    {
      "name": "Gallo",
      "classification": "primary",
      "entity_type": "person",
      "primary": true,
      "person_id": "~{\"name\": \"Gallo\"}",
      "organization_id": null
    },
    {
      "name": "Euer",
      "classification": "primary",
      "entity_type": "person",
      "primary": true,
      "person_id": "~{\"name\": \"Euer\"}",
      "organization_id": null
    },
    {
      "name": "Lawson",
      "classification": "primary",
      "entity_type": "person",
      "primary": true,
      "person_id": "~{\"name\": \"Lawson\"}",
      "organization_id": null
    },
    {
      "name": "Tikoian",
      "classification": "primary",
      "entity_type": "person",
      "primary": true,
      "person_id": "~{\"name\": \"Tikoian\"}",
      "organization_id": null
    },
    {
      "name": "de la Cruz",
      "classification": "primary",
      "entity_type": "person",
      "primary": true,
      "person_id": "~{\"name\": \"de la Cruz\"}",
      "organization_id": null
    },
    {
      "name": "Urso",
      "classification": "primary",
      "entity_type": "person",
      "primary": true,
      "person_id": "~{\"name\": \"Urso\"}",
      "organization_id": null
    },
    {
      "name": "Felag",
      "classification": "primary",
      "entity_type": "person",
      "primary": true,
      "person_id": "~{\"name\": \"Felag\"}",
      "organization_id": null
    },
    {
      "name": "Patalano",
      "classification": "primary",
      "entity_type": "person",
      "primary": true,
      "person_id": "~{\"name\": \"Patalano\"}",
      "organization_id": null
    },
    {
      "name": "Burke",
      "classification": "primary",
      "entity_type": "person",
      "primary": true,
      "person_id": "~{\"name\": \"Burke\"}",
      "organization_id": null
    }
  ],
  "related_bills": [],
  "versions": [
    {
      "note": "880",
      "links": [
        {
          "url": "http://webserver.rilegislature.gov/BillText/BillText25/SenateText25/S0880.pdf",
          "media_type": "application/pdf"
        }
      ],
      "date": "",
      "classification": ""
    }
  ],
  "documents": [],
  "citations": [],
  "sources": [
    {
      "url": "https://status.rilegislature.gov/",
      "note": ""
    }
  ],
  "extras": {},
  "jurisdiction": {
    "id": "ocd-jurisdiction/country:us/state:ri/government",
    "name": "Rhode Island",
    "classification": "state",
    "division_id": "ocd-division/country:us/state:ri"
  },
  "_processing": {
    "logs_latest_update": "2025-11-26T03:04:58Z"
  }
}