{
  "legislative_session": "2025",
  "identifier": "SB818",
  "title": "AN ACT RELATING TO CRIMINAL PROCEDURE -- SENTENCE AND EXECUTION",
  "from_organization": "~{\"classification\": \"upper\"}",
  "classification": [
    "bill"
  ],
  "subject": [],
  "abstracts": [
    {
      "note": "summary",
      "abstract": "Eliminates the \"doubt\" about culpability requirement and replace it with \"unwilling\" or \"unable\" to pursue charge(s) in cases for persons sentenced to imprisonment for violations of suspended sentence."
    }
  ],
  "other_titles": [],
  "other_identifiers": [],
  "actions": [
    {
      "description": "03/14/2025 Introduced, referred to Senate Judiciary",
      "date": "2025-03-14",
      "organization_id": "~{\"classification\": \"upper\"}",
      "classification": [
        "introduction",
        "referral-committee"
      ],
      "related_entities": [],
      "_processing": {
        "log_file_created": "2025-11-26T03:05:01Z"
      }
    },
    {
      "description": "05/09/2025 Scheduled for hearing and/or consideration  (05/13/2025)",
      "date": "2025-05-09",
      "organization_id": "~{\"classification\": \"legislature\"}",
      "classification": [],
      "related_entities": [],
      "_processing": {
        "log_file_created": "2025-11-26T03:05:01Z"
      }
    },
    {
      "description": "05/13/2025 Committee recommended measure be held for further study",
      "date": "2025-05-13",
      "organization_id": "~{\"classification\": \"legislature\"}",
      "classification": [
        "committee-failure"
      ],
      "related_entities": [],
      "_processing": {
        "log_file_created": "2025-11-26T03:05:01Z"
      }
    }
  ],
  "sponsorships": [
    {
      "name": "Dimitri",
      "classification": "primary",
      "entity_type": "person",
      "primary": true,
      "person_id": "~{\"name\": \"Dimitri\"}",
      "organization_id": null
    },
    {
      "name": "Bissaillon",
      "classification": "primary",
      "entity_type": "person",
      "primary": true,
      "person_id": "~{\"name\": \"Bissaillon\"}",
      "organization_id": null
    },
    {
      "name": "Zurier",
      "classification": "primary",
      "entity_type": "person",
      "primary": true,
      "person_id": "~{\"name\": \"Zurier\"}",
      "organization_id": null
    }
  ],
  "related_bills": [],
  "versions": [
    {
      "note": "818",
      "links": [
        {
          "url": "http://webserver.rilegislature.gov/BillText/BillText25/SenateText25/S0818.pdf",
          "media_type": "application/pdf"
        }
      ],
      "date": "",
      "classification": ""
    }
  ],
  "documents": [],
  "citations": [],
  "sources": [
    {
      "url": "https://status.rilegislature.gov/",
      "note": ""
    }
  ],
  "extras": {},
  "jurisdiction": {
    "id": "ocd-jurisdiction/country:us/state:ri/government",
    "name": "Rhode Island",
    "classification": "state",
    "division_id": "ocd-division/country:us/state:ri"
  },
  "_processing": {
    "logs_latest_update": "2025-11-26T03:05:01Z"
  }
}