{
  "legislative_session": "2025",
  "identifier": "SB928",
  "title": "AN ACT RELATING TO ANIMALS AND ANIMAL HUSBANDRY -- REGULATION OF VICIOUS DOGS",
  "from_organization": "~{\"classification\": \"upper\"}",
  "classification": [
    "bill"
  ],
  "subject": [],
  "abstracts": [
    {
      "note": "summary",
      "abstract": "Changes term vicious to dangerous dogs, expands on requirements relative to leashes, enclosures, addresses fines, requires signage, mandates dangerous dogs be kept in enclosure and provides other requirements."
    }
  ],
  "other_titles": [],
  "other_identifiers": [],
  "actions": [
    {
      "description": "03/28/2025 Introduced, referred to Senate Judiciary",
      "date": "2025-03-28",
      "organization_id": "~{\"classification\": \"upper\"}",
      "classification": [
        "introduction",
        "referral-committee"
      ],
      "related_entities": [],
      "_processing": {
        "log_file_created": "2025-11-26T03:05:02Z"
      }
    },
    {
      "description": "04/04/2025 Scheduled for hearing and/or consideration  (04/10/2025)",
      "date": "2025-04-04",
      "organization_id": "~{\"classification\": \"legislature\"}",
      "classification": [],
      "related_entities": [],
      "_processing": {
        "log_file_created": "2025-11-26T03:05:02Z"
      }
    },
    {
      "description": "04/10/2025 Committee recommended measure be held for further study",
      "date": "2025-04-10",
      "organization_id": "~{\"classification\": \"legislature\"}",
      "classification": [
        "committee-failure"
      ],
      "related_entities": [],
      "_processing": {
        "log_file_created": "2025-11-26T03:05:02Z"
      }
    }
  ],
  "sponsorships": [
    {
      "name": "Britto",
      "classification": "primary",
      "entity_type": "person",
      "primary": true,
      "person_id": "~{\"name\": \"Britto\"}",
      "organization_id": null
    },
    {
      "name": "Bissaillon",
      "classification": "primary",
      "entity_type": "person",
      "primary": true,
      "person_id": "~{\"name\": \"Bissaillon\"}",
      "organization_id": null
    },
    {
      "name": "Ciccone",
      "classification": "primary",
      "entity_type": "person",
      "primary": true,
      "person_id": "~{\"name\": \"Ciccone\"}",
      "organization_id": null
    },
    {
      "name": "Gu",
      "classification": "primary",
      "entity_type": "person",
      "primary": true,
      "person_id": "~{\"name\": \"Gu\"}",
      "organization_id": null
    },
    {
      "name": "DiPalma",
      "classification": "primary",
      "entity_type": "person",
      "primary": true,
      "person_id": "~{\"name\": \"DiPalma\"}",
      "organization_id": null
    },
    {
      "name": "Thompson",
      "classification": "primary",
      "entity_type": "person",
      "primary": true,
      "person_id": "~{\"name\": \"Thompson\"}",
      "organization_id": null
    }
  ],
  "related_bills": [],
  "versions": [
    {
      "note": "928",
      "links": [
        {
          "url": "http://webserver.rilegislature.gov/BillText/BillText25/SenateText25/S0928.pdf",
          "media_type": "application/pdf"
        }
      ],
      "date": "",
      "classification": ""
    }
  ],
  "documents": [],
  "citations": [],
  "sources": [
    {
      "url": "https://status.rilegislature.gov/",
      "note": ""
    }
  ],
  "extras": {},
  "jurisdiction": {
    "id": "ocd-jurisdiction/country:us/state:ri/government",
    "name": "Rhode Island",
    "classification": "state",
    "division_id": "ocd-division/country:us/state:ri"
  },
  "_processing": {
    "logs_latest_update": "2025-11-26T03:05:02Z"
  }
}