{
  "legislative_session": "2025-2026",
  "identifier": "H 46",
  "title": "An act relating to the Rare Disease Advisory Council",
  "from_organization": "~{\"classification\": \"lower\"}",
  "classification": [
    "bill"
  ],
  "subject": [],
  "abstracts": [],
  "other_titles": [],
  "other_identifiers": [],
  "actions": [
    {
      "description": "Read first time and referred to the Committee on Human Services",
      "date": "2025-01-21",
      "organization_id": "~{\"classification\": \"lower\"}",
      "classification": [
        "introduction"
      ],
      "related_entities": [],
      "_processing": {
        "log_file_created": "2025-11-26T05:54:34Z"
      }
    },
    {
      "description": "Notice Calendar: Favorable with Amendment",
      "date": "2025-05-06",
      "organization_id": "~{\"classification\": \"lower\"}",
      "classification": [],
      "related_entities": [],
      "_processing": {
        "log_file_created": "2025-11-26T05:54:34Z"
      }
    },
    {
      "description": "Referred to Committee on Appropriations per Rule 35(a)",
      "date": "2025-05-06",
      "organization_id": "~{\"classification\": \"lower\"}",
      "classification": [],
      "related_entities": [],
      "_processing": {
        "log_file_created": "2025-11-26T05:54:34Z"
      }
    },
    {
      "description": "Notice Calendar: Favorable with Amendment",
      "date": "2025-05-09",
      "organization_id": "~{\"classification\": \"lower\"}",
      "classification": [],
      "related_entities": [],
      "_processing": {
        "log_file_created": "2025-11-26T05:54:34Z"
      }
    },
    {
      "description": "Action Calendar: Favorable with Amendment",
      "date": "2025-05-12",
      "organization_id": "~{\"classification\": \"lower\"}",
      "classification": [],
      "related_entities": [],
      "_processing": {
        "log_file_created": "2025-11-26T05:54:34Z"
      }
    },
    {
      "description": "Action Calendar: Unfinished Business",
      "date": "2025-05-13",
      "organization_id": "~{\"classification\": \"lower\"}",
      "classification": [],
      "related_entities": [],
      "_processing": {
        "log_file_created": "2025-11-26T05:54:34Z"
      }
    },
    {
      "description": "Read second time",
      "date": "2025-05-13",
      "organization_id": "~{\"classification\": \"lower\"}",
      "classification": [
        "reading-2"
      ],
      "related_entities": [],
      "_processing": {
        "log_file_created": "2025-11-26T05:54:34Z"
      }
    },
    {
      "description": "Rep. Garofano of Essex reported for the Committee on Human Services",
      "date": "2025-05-13",
      "organization_id": "~{\"classification\": \"lower\"}",
      "classification": [],
      "related_entities": [],
      "_processing": {
        "log_file_created": "2025-11-26T05:54:34Z"
      }
    },
    {
      "description": "Rep. Bluemle of Burlington recommended for the Committee on Appropriations",
      "date": "2025-05-13",
      "organization_id": "~{\"classification\": \"lower\"}",
      "classification": [],
      "related_entities": [],
      "_processing": {
        "log_file_created": "2025-11-26T05:54:34Z"
      }
    },
    {
      "description": "Report of Committee on Human Services agreed to",
      "date": "2025-05-13",
      "organization_id": "~{\"classification\": \"lower\"}",
      "classification": [],
      "related_entities": [],
      "_processing": {
        "log_file_created": "2025-11-26T05:54:34Z"
      }
    },
    {
      "description": "Third Reading ordered",
      "date": "2025-05-13",
      "organization_id": "~{\"classification\": \"lower\"}",
      "classification": [
        "reading-3"
      ],
      "related_entities": [],
      "_processing": {
        "log_file_created": "2025-11-26T05:54:34Z"
      }
    },
    {
      "description": "Action Calendar: Third Reading",
      "date": "2025-05-14",
      "organization_id": "~{\"classification\": \"lower\"}",
      "classification": [
        "reading-3"
      ],
      "related_entities": [],
      "_processing": {
        "log_file_created": "2025-11-26T05:54:34Z"
      }
    },
    {
      "description": "Read third time and passed",
      "date": "2025-05-14",
      "organization_id": "~{\"classification\": \"lower\"}",
      "classification": [
        "reading-3"
      ],
      "related_entities": [],
      "_processing": {
        "log_file_created": "2025-11-26T05:54:34Z"
      }
    },
    {
      "description": "Read 1st time & referred to Committee on Rules",
      "date": "2025-05-16",
      "organization_id": "~{\"classification\": \"upper\"}",
      "classification": [
        "introduction"
      ],
      "related_entities": [],
      "_processing": {
        "log_file_created": "2025-11-26T05:54:34Z"
      }
    }
  ],
  "sponsorships": [
    {
      "name": "Anne Donahue",
      "classification": "primary",
      "entity_type": "person",
      "primary": true,
      "person_id": "~{\"chamber\": \"lower\", \"name\": \"Anne Donahue\"}",
      "organization_id": null
    },
    {
      "name": "Daniel Noyes",
      "classification": "primary",
      "entity_type": "person",
      "primary": true,
      "person_id": "~{\"chamber\": \"lower\", \"name\": \"Daniel Noyes\"}",
      "organization_id": null
    },
    {
      "name": "Mary-Katherine Stone",
      "classification": "primary",
      "entity_type": "person",
      "primary": true,
      "person_id": "~{\"chamber\": \"lower\", \"name\": \"Mary-Katherine Stone\"}",
      "organization_id": null
    }
  ],
  "related_bills": [],
  "versions": [
    {
      "note": "As Introduced",
      "links": [
        {
          "url": "https://legislature.vermont.gov/Documents/2026/Docs/BILLS/H-0046/H-0046%20As%20Introduced.pdf",
          "media_type": "application/pdf"
        }
      ],
      "date": "",
      "classification": ""
    },
    {
      "note": "As Passed By the House (Official)",
      "links": [
        {
          "url": "https://legislature.vermont.gov/Documents/2026/Docs/BILLS/H-0046/H-0046%20As%20passed%20by%20the%20House%20Official.pdf",
          "media_type": "application/pdf"
        }
      ],
      "date": "",
      "classification": ""
    },
    {
      "note": "As Passed By the House (Unofficial)",
      "links": [
        {
          "url": "https://legislature.vermont.gov/Documents/2026/Docs/BILLS/H-0046/H-0046%20As%20Passed%20by%20the%20House%20Unofficial.pdf",
          "media_type": "application/pdf"
        }
      ],
      "date": "",
      "classification": ""
    }
  ],
  "documents": [
    {
      "note": "Witness List",
      "links": [
        {
          "url": "https://legislature.vermont.gov/bill/print/2026/H46/witnesses",
          "media_type": "text/html"
        }
      ],
      "date": "",
      "classification": ""
    },
    {
      "note": "Committee Meetings",
      "links": [
        {
          "url": "https://legislature.vermont.gov/bill/print/2026/H46/meetings",
          "media_type": "text/html"
        }
      ],
      "date": "",
      "classification": ""
    }
  ],
  "citations": [],
  "sources": [
    {
      "url": "http://legislature.vermont.gov/bill/loadBillsIntroduced/2026/",
      "note": ""
    },
    {
      "url": "http://legislature.vermont.gov/bill/status/2026/H.46",
      "note": ""
    },
    {
      "url": "http://legislature.vermont.gov/bill/loadBillDetailedStatus/2026/273",
      "note": ""
    },
    {
      "url": "http://legislature.vermont.gov/bill/loadBillRollCalls/2026/273",
      "note": ""
    }
  ],
  "extras": {},
  "jurisdiction": {
    "id": "ocd-jurisdiction/country:us/state:vt/government",
    "name": "Vermont",
    "classification": "state",
    "division_id": "ocd-division/country:us/state:vt"
  },
  "_processing": {
    "logs_latest_update": "2025-11-26T05:54:35Z"
  }
}