{
  "legislative_session": "2025",
  "identifier": "SB91",
  "title": "AN ACT RELATING TO HEALTH AND SAFETY -- BUILDING DECARBONIZATION ACT OF 2024",
  "from_organization": "~{\"classification\": \"upper\"}",
  "classification": [
    "bill"
  ],
  "subject": [],
  "abstracts": [
    {
      "note": "summary",
      "abstract": "Establishes the environmental justice advisory board (EJAB) to implement  standards for buildings that emit greenhouse gases."
    }
  ],
  "other_titles": [],
  "other_identifiers": [],
  "actions": [
    {
      "description": "01/31/2025 Introduced, referred to Senate Environment and Agriculture",
      "date": "2025-01-31",
      "organization_id": "~{\"classification\": \"upper\"}",
      "classification": [
        "introduction",
        "referral-committee"
      ],
      "related_entities": [],
      "_processing": {
        "log_file_created": "2025-11-26T03:05:04Z"
      }
    },
    {
      "description": "04/04/2025 Scheduled for hearing and/or consideration  (04/09/2025)",
      "date": "2025-04-04",
      "organization_id": "~{\"classification\": \"legislature\"}",
      "classification": [],
      "related_entities": [],
      "_processing": {
        "log_file_created": "2025-11-26T03:05:04Z"
      }
    },
    {
      "description": "04/09/2025 Committee recommended measure be held for further study",
      "date": "2025-04-09",
      "organization_id": "~{\"classification\": \"legislature\"}",
      "classification": [
        "committee-failure"
      ],
      "related_entities": [],
      "_processing": {
        "log_file_created": "2025-11-26T03:05:04Z"
      }
    }
  ],
  "sponsorships": [
    {
      "name": "Kallman",
      "classification": "primary",
      "entity_type": "person",
      "primary": true,
      "person_id": "~{\"name\": \"Kallman\"}",
      "organization_id": null
    },
    {
      "name": "Sosnowski",
      "classification": "primary",
      "entity_type": "person",
      "primary": true,
      "person_id": "~{\"name\": \"Sosnowski\"}",
      "organization_id": null
    },
    {
      "name": "DiMario",
      "classification": "primary",
      "entity_type": "person",
      "primary": true,
      "person_id": "~{\"name\": \"DiMario\"}",
      "organization_id": null
    },
    {
      "name": "Euer",
      "classification": "primary",
      "entity_type": "person",
      "primary": true,
      "person_id": "~{\"name\": \"Euer\"}",
      "organization_id": null
    },
    {
      "name": "Lawson",
      "classification": "primary",
      "entity_type": "person",
      "primary": true,
      "person_id": "~{\"name\": \"Lawson\"}",
      "organization_id": null
    },
    {
      "name": "Britto",
      "classification": "primary",
      "entity_type": "person",
      "primary": true,
      "person_id": "~{\"name\": \"Britto\"}",
      "organization_id": null
    },
    {
      "name": "Gu",
      "classification": "primary",
      "entity_type": "person",
      "primary": true,
      "person_id": "~{\"name\": \"Gu\"}",
      "organization_id": null
    },
    {
      "name": "Gallo",
      "classification": "primary",
      "entity_type": "person",
      "primary": true,
      "person_id": "~{\"name\": \"Gallo\"}",
      "organization_id": null
    },
    {
      "name": "McKenney",
      "classification": "primary",
      "entity_type": "person",
      "primary": true,
      "person_id": "~{\"name\": \"McKenney\"}",
      "organization_id": null
    },
    {
      "name": "Valverde",
      "classification": "primary",
      "entity_type": "person",
      "primary": true,
      "person_id": "~{\"name\": \"Valverde\"}",
      "organization_id": null
    }
  ],
  "related_bills": [],
  "versions": [
    {
      "note": "91",
      "links": [
        {
          "url": "http://webserver.rilegislature.gov/BillText/BillText25/SenateText25/S0091.pdf",
          "media_type": "application/pdf"
        }
      ],
      "date": "",
      "classification": ""
    }
  ],
  "documents": [],
  "citations": [],
  "sources": [
    {
      "url": "https://status.rilegislature.gov/",
      "note": ""
    }
  ],
  "extras": {},
  "jurisdiction": {
    "id": "ocd-jurisdiction/country:us/state:ri/government",
    "name": "Rhode Island",
    "classification": "state",
    "division_id": "ocd-division/country:us/state:ri"
  },
  "_processing": {
    "logs_latest_update": "2025-11-26T03:05:04Z"
  }
}