{
  "legislative_session": "2025",
  "identifier": "SB635",
  "title": "AN ACT RELATING TO EDUCATION -- HEALTH AND SAFETY OF PUPILS",
  "from_organization": "~{\"classification\": \"upper\"}",
  "classification": [
    "bill"
  ],
  "subject": [],
  "abstracts": [
    {
      "note": "summary",
      "abstract": "Requires immediate notification to the person in charge of the educational program when a child has a cardiac emergency and the head of the educational program must notify the department of education within 24 hours."
    }
  ],
  "other_titles": [],
  "other_identifiers": [],
  "actions": [
    {
      "description": "03/07/2025 Introduced, referred to Senate Education",
      "date": "2025-03-07",
      "organization_id": "~{\"classification\": \"upper\"}",
      "classification": [
        "introduction",
        "referral-committee"
      ],
      "related_entities": [],
      "_processing": {
        "log_file_created": "2025-11-26T03:05:00Z"
      }
    },
    {
      "description": "04/04/2025 Scheduled for hearing and/or consideration  (04/09/2025)",
      "date": "2025-04-04",
      "organization_id": "~{\"classification\": \"legislature\"}",
      "classification": [],
      "related_entities": [],
      "_processing": {
        "log_file_created": "2025-11-26T03:05:00Z"
      }
    },
    {
      "description": "04/09/2025 Committee recommended measure be held for further study",
      "date": "2025-04-09",
      "organization_id": "~{\"classification\": \"legislature\"}",
      "classification": [
        "committee-failure"
      ],
      "related_entities": [],
      "_processing": {
        "log_file_created": "2025-11-26T03:05:00Z"
      }
    }
  ],
  "sponsorships": [
    {
      "name": "McKenney",
      "classification": "primary",
      "entity_type": "person",
      "primary": true,
      "person_id": "~{\"name\": \"McKenney\"}",
      "organization_id": null
    },
    {
      "name": "Britto",
      "classification": "primary",
      "entity_type": "person",
      "primary": true,
      "person_id": "~{\"name\": \"Britto\"}",
      "organization_id": null
    },
    {
      "name": "Murray",
      "classification": "primary",
      "entity_type": "person",
      "primary": true,
      "person_id": "~{\"name\": \"Murray\"}",
      "organization_id": null
    },
    {
      "name": "Appollonio",
      "classification": "primary",
      "entity_type": "person",
      "primary": true,
      "person_id": "~{\"name\": \"Appollonio\"}",
      "organization_id": null
    },
    {
      "name": "Lauria",
      "classification": "primary",
      "entity_type": "person",
      "primary": true,
      "person_id": "~{\"name\": \"Lauria\"}",
      "organization_id": null
    },
    {
      "name": "Urso",
      "classification": "primary",
      "entity_type": "person",
      "primary": true,
      "person_id": "~{\"name\": \"Urso\"}",
      "organization_id": null
    }
  ],
  "related_bills": [],
  "versions": [
    {
      "note": "635",
      "links": [
        {
          "url": "http://webserver.rilegislature.gov/BillText/BillText25/SenateText25/S0635.pdf",
          "media_type": "application/pdf"
        }
      ],
      "date": "",
      "classification": ""
    }
  ],
  "documents": [],
  "citations": [],
  "sources": [
    {
      "url": "https://status.rilegislature.gov/",
      "note": ""
    }
  ],
  "extras": {},
  "jurisdiction": {
    "id": "ocd-jurisdiction/country:us/state:ri/government",
    "name": "Rhode Island",
    "classification": "state",
    "division_id": "ocd-division/country:us/state:ri"
  },
  "_processing": {
    "logs_latest_update": "2025-11-26T03:05:00Z"
  }
}